{
  "id": "a2-independent-check",
  "run_id": "exp001-freeze-baseline-tamper",
  "phase_id": "P2-EXPERIMENT-001",
  "type": "command",
  "command": "node -e \"console.log('ok')\"",
  "exit_code": 0,
  "started_at": "2026-08-16T05:49:35.950Z",
  "ended_at": "2026-08-16T05:49:36.393Z",
  "cwd": "C:\\Users\\SuperAdmin\\.vscode\\runtime-firewall-mvp",
  "git_sha": "24db6be0b7caa6845f9e07884115b8b6cba71123",
  "stdout_sha256": "dc51b8c96c2d745df3bd5590d990230a482fd247123599548e0632fdbf97fc22",
  "stderr_sha256": "e3b0c44298fc1c149afbf4c8996fb92427ae41e4649b934ca495991b7852b855",
  "stdout_excerpt": "ok\n",
  "stderr_excerpt": "",
  "timed_out": false
}
