{
  "id": "a1-test",
  "run_id": "exp001-freeze-sha-mismatch",
  "phase_id": "P2-EXPERIMENT-001",
  "type": "command",
  "command": "node packages/fw-agent/test/__agent-experiment-001-fixture.js",
  "exit_code": 0,
  "started_at": "2026-08-16T01:57:08.120Z",
  "ended_at": "2026-08-16T01:57:08.312Z",
  "cwd": "/workspaces/runtime-firewall-mvp",
  "git_sha": "3e91bd42c4c8eda385275f354d705894ee1ca759",
  "stdout_sha256": "f75cd19b3d5a55daf7d74f309553169d4a14ceb56a8e672512165b0182c0aa34",
  "stderr_sha256": "e3b0c44298fc1c149afbf4c8996fb92427ae41e4649b934ca495991b7852b855",
  "stdout_excerpt": "P2-EXPERIMENT-001 fixture: OK\n",
  "stderr_excerpt": "",
  "timed_out": false
}
